{
  "$schema": "http://json-schema.org/draft-07/schema#",
  "$id": "http://example.com/es-mapping.schema.json",
  "title": "Elasticsearch fields",
  "type": "object",
  "properties": {
    "id": {"type":"string", "enum": ["9"]},
    "text": {"type":"string"},
    "facsimiles": { "type":"array", "items": {"enum": [
      "https://images.huygens.knaw.nl/iiif/hca30-223/1/nl-hana_hca30-223_1_0103.tif/info.json",
      "https://images.huygens.knaw.nl/iiif/hca30-223/1/nl-hana_hca30-223_1_0104.tif/info.json",
      "https://images.huygens.knaw.nl/iiif/hca30-223/1/nl-hana_hca30-223_1_0105.tif/info.json"
    ]}},
    "corr": {"type":"string", "enum": ["Gekaapte brieven"]},
    "date": {"type":"string", "enum": ["1672-05-15"]},
    "sender": {"type":"string", "enum": ["Jelte Pieters"]},
    "sendergender": {"type":"string", "enum": ["Vrouw"]},
    "recipient": {"type":"string", "enum": ["Andries Volkersen"]},
    "recipientgender": {"type":"string", "enum": ["Man"]},
    "recipientship": {"type":"string", "enum": ["Zoetendaal"]},
    "texttypes": {"type":"array", "items": { "enum": ["Onbekend"]}},
    "languages": {"type":"array", "items": { "enum": ["Duits"]}},
    "has_date": {"type":"boolean", "enum": [true]},
    "sender_or_recipient": {"type":"array", "items": { "enum": ["Jelte Pieters", "Andries Volkersen"]}},
    "person": {"type":"array", "items": { "enum": ["Augusto & Caesare"]}},
    "org": {"type":"array", "items": { "enum": ["Regnante Invictissimo Romanorum Imperatore ac"]}},
    "loc": {"type":"array", "items": { "enum": ["Dreijfaltigkeitt  Amen\n  Anno Christi"]}},
    "misc": {"type":"array", "items": { "enum": ["Indi-"]}}
  },
  "required": ["id","text","facsimiles","corr","date","sender","sendergender","recipient","recipientgender","recipientship","texttypes","languages","has_date","sender_or_recipient","person","org","loc","misc"
  ]
}
